{
  "schema_version": "1.0.0",
  "seeds": {
    "episode_base": 12345,
    "random_policy": 12345
  },
  "episodes": {
    "repeats": 1,
    "min_targets": 2
  },
  "criterion": {
    "primary_metric": "success_rate",
    "confidence_level": 0.95
  },
  "stats": {
    "bootstrap_resamples": 10000,
    "bootstrap_seed": 0
  },
  "logs": {
    "source": "auto",
    "tags": {
      "loss_prefix": "loss",
      "reward_prefix": "reward",
      "activation_prefix": "activation/"
    }
  },
  "charts": {
    "dpi": 120,
    "format": "png"
  },
  "paths": {
    "runs_dir": "runs",
    "env_config_override": null,
    "expect_fingerprint_sha256": null
  }
}
